{
  "artifact_type": "gate3_execution_universe_readiness",
  "artifact_version": "gate3.execution-universe-readiness.v1",
  "authority_hashes": {
    "policy_sha256": "db5ef397c2612d12bda351c64772c6cd24ea49636151f20d3aea79c6bb5d7203",
    "catalog_sha256": "079c35e5d783dcbaefbdf847c78e955646f7460b0046faf1d7c4373fb42d1a89",
    "paraphrase_registry_sha256": "f3d230da97621d51643736c485fd122344d49538f7a4eda5a4ca6e1a06bbec52",
    "operator_registry_sha256": "d1486841e0a557f8d0c57a99773e41122cc31acd2068668f99ba7e97a002aea3",
    "operator_scenario_registry_sha256": "5075974154665e4b81000ea51cf4dcc5f037d5a0ca080e1eb19c22d38fb501f0",
    "trace_profiles_sha256": "118898bae2537d7539a0d7fffe0c17c87bf6ef11b8a99f8c32d4604a799e146c",
    "grader_registry_sha256": "9585b1895477bc42fe8764d9453ef2d4465e746939b116c4eaa6f05c2cb29740",
    "source_run_manifest_sha256": "ed004046a20d00d9d44c24a04518b8de3368772815bbcfdb259e405c162f1ad0",
    "protected_held_out_manifest_sha256": "d851187b829a98659ec61fe1018edbaf9bf7bf89cad32f64f098a7c1d1394c34",
    "compiler_release_sha256": "e15948e894d2aa0f429520a19b856ad59ed1ee604dc2a13a00adc9123bfaea52"
  },
  "universe_summary": {
    "episode_count": 36,
    "case_variant_count": 156,
    "risk_variant_counts": {
      "medium": 8,
      "high": 95,
      "critical": 53
    },
    "required_coordinate_count": 1172,
    "required_coordinate_set_sha256": "ed6f4e8e761db27d7a202ef778857af286169d2846900bf5c348c5885fde22f6",
    "required_episode_relation_group_count": 2011,
    "required_episode_relation_group_set_sha256": "ab84bb796159ff97a8ef638174f4e34f12a3268cbb1dcb8174c48a0bbd2aa0ba",
    "required_operator_scenario_coordinate_count": 0,
    "required_operator_scenario_coordinate_set_sha256": "4f53cda18c2baa0c0354bb5f9a3ecbe5ed12ab4d8e11ba873c2f11161202b945",
    "required_operator_scenario_relation_group_count": 0,
    "required_operator_scenario_relation_group_set_sha256": "4f53cda18c2baa0c0354bb5f9a3ecbe5ed12ab4d8e11ba873c2f11161202b945",
    "required_paraphrase_authority_count": 201,
    "required_operator_scenario_count": 38
  },
  "operator_coverage": [
    {
      "operator_ref": "boundary_or_interaction_change",
      "operator_sha256": "bcb5e0589a95247f4cd781222aa71fa9e13703f07dd8130915523d42291ceec7",
      "coverage_source": "episode_relation",
      "authority_refs": [
        "G3-ADV-001-CF03",
        "G3-ADV-002-CF03",
        "G3-ADV-004-CF03",
        "G3-ADV-005-CF03",
        "G3-ADV-006-CF03",
        "G3-ADV-007-CF03",
        "G3-ADV-008-CF03",
        "G3-ADV-009-CF03",
        "G3-EXP-001-CF03",
        "G3-EXP-002-CF03",
        "G3-EXP-005-CF03",
        "G3-EXP-007-CF03",
        "G3-EXP-008-CF03",
        "G3-EXP-010-CF03",
        "G3-EXP-012-CF03",
        "G3-GF-001-CF04",
        "G3-GF-002-CF03",
        "G3-GF-003-CF03",
        "G3-GF-003-CF04",
        "G3-GF-004-CF02",
        "G3-GF-004-CF04",
        "G3-GF-005-CF02",
        "G3-GF-005-CF03",
        "G3-GF-006-CF03",
        "G3-GF-006-CF04",
        "G3-GF-007-CF02",
        "G3-GF-007-CF04",
        "G3-GF-008-CF02",
        "G3-GF-008-CF04",
        "G3-GF-009-CF02",
        "G3-GF-010-CF02",
        "G3-GF-010-CF03",
        "G3-GF-011-CF03",
        "G3-GF-011-CF04",
        "G3-GF-012-CF03",
        "G3-GF-012-CF04",
        "G3-ROOT-001-CF03",
        "G3-USER-001-CF03",
        "G3-USER-002-CF03",
        "G3-USER-003-CF03",
        "G3-USER-004-CF03",
        "G3-USER-005-CF03",
        "G3-USER-006-CF03",
        "G3-USER-007-CF03",
        "G3-USER-008-CF03"
      ]
    },
    {
      "operator_ref": "calendar_release_version_change",
      "operator_sha256": "2a95b6af9994bcb86ff3d1a735fd40aae22b797308d159ab26f10ed09cb7ceb6",
      "coverage_source": "missing",
      "authority_refs": []
    },
    {
      "operator_ref": "claim_scope_strength_drift",
      "operator_sha256": "77bf4d71ef23976255b011fc4c283d6cc4ba8b7795fb96230049d19bcba90748",
      "coverage_source": "missing",
      "authority_refs": []
    },
    {
      "operator_ref": "cohort_horizon_change",
      "operator_sha256": "28722f847ef86eccb3eb0d56c36a145330bc6070edf04cdac46b1402afa582b0",
      "coverage_source": "missing",
      "authority_refs": []
    },
    {
      "operator_ref": "contrast_order_swap",
      "operator_sha256": "fdc20cad30d823535dfcf02869d405f346f523cb07fee426a2bfe27bf743f9b7",
      "coverage_source": "missing",
      "authority_refs": []
    },
    {
      "operator_ref": "decomposition_residual_policy_change",
      "operator_sha256": "e9faa43b4d39b9c50bdbf1c2462d59049c4bbe0199009388fc98819a19371d06",
      "coverage_source": "missing",
      "authority_refs": []
    },
    {
      "operator_ref": "episode_outcome",
      "operator_sha256": "620fd3c2b5a0d6078b67b3e8b0478b2e2618cddbdd3ad08f12c8619cbca48493",
      "coverage_source": "standalone",
      "authority_refs": [
        "catalog:all-execution-coordinates"
      ]
    },
    {
      "operator_ref": "estimator_exposure_change",
      "operator_sha256": "3c34af5e35c068c561c24b50c6ec1a7b9b558d8ef4a0e25ad31c15cb41f17311",
      "coverage_source": "missing",
      "authority_refs": []
    },
    {
      "operator_ref": "evidence_identity_drift",
      "operator_sha256": "f45205697ab1b1a74bd47c38f5a16e526b5f97149c8c231d04c1e3ba5dc15983",
      "coverage_source": "missing",
      "authority_refs": []
    },
    {
      "operator_ref": "funnel_stage_order_change",
      "operator_sha256": "0b91e55081a38725a42da144f183e5444fee32eb6ecd2f4b6975f24cbe7f443b",
      "coverage_source": "missing",
      "authority_refs": []
    },
    {
      "operator_ref": "material_semantic_change",
      "operator_sha256": "0ebcca5dc0cf6210542b65d8c59a37cc89ff45a9030511e70c43eefbe15cc606",
      "coverage_source": "episode_relation",
      "authority_refs": [
        "G3-ADV-001-CF02",
        "G3-ADV-002-CF02",
        "G3-ADV-004-CF02",
        "G3-ADV-005-CF02",
        "G3-ADV-006-CF02",
        "G3-ADV-007-CF02",
        "G3-ADV-008-CF02",
        "G3-ADV-009-CF02",
        "G3-EXP-001-CF02",
        "G3-EXP-002-CF02",
        "G3-EXP-005-CF02",
        "G3-EXP-007-CF02",
        "G3-EXP-008-CF02",
        "G3-EXP-010-CF02",
        "G3-EXP-012-CF02",
        "G3-GF-001-CF02",
        "G3-GF-001-CF03",
        "G3-GF-002-CF02",
        "G3-GF-002-CF04",
        "G3-GF-003-CF02",
        "G3-GF-004-CF03",
        "G3-GF-005-CF04",
        "G3-GF-006-CF02",
        "G3-GF-007-CF03",
        "G3-GF-008-CF03",
        "G3-GF-009-CF03",
        "G3-GF-009-CF04",
        "G3-GF-010-CF04",
        "G3-GF-011-CF02",
        "G3-GF-012-CF02",
        "G3-ROOT-001-CF02",
        "G3-USER-001-CF02",
        "G3-USER-002-CF02",
        "G3-USER-003-CF02",
        "G3-USER-004-CF02",
        "G3-USER-005-CF02",
        "G3-USER-006-CF02",
        "G3-USER-007-CF02",
        "G3-USER-008-CF02"
      ]
    },
    {
      "operator_ref": "meaning_preserving_case_mutation",
      "operator_sha256": "65410af8d6e9e4e0d155e75538bc66086d7b694bae706944e044220fe5dea200",
      "coverage_source": "episode_relation",
      "authority_refs": [
        "G3-ADV-001-CF01",
        "G3-ADV-002-CF01",
        "G3-ADV-004-CF01",
        "G3-ADV-005-CF01",
        "G3-ADV-006-CF01",
        "G3-ADV-007-CF01",
        "G3-ADV-008-CF01",
        "G3-ADV-009-CF01",
        "G3-EXP-001-CF01",
        "G3-EXP-002-CF01",
        "G3-EXP-005-CF01",
        "G3-EXP-007-CF01",
        "G3-EXP-008-CF01",
        "G3-EXP-010-CF01",
        "G3-EXP-012-CF01",
        "G3-GF-001-CF01",
        "G3-GF-002-CF01",
        "G3-GF-003-CF01",
        "G3-GF-004-CF01",
        "G3-GF-005-CF01",
        "G3-GF-006-CF01",
        "G3-GF-007-CF01",
        "G3-GF-008-CF01",
        "G3-GF-009-CF01",
        "G3-GF-010-CF01",
        "G3-GF-011-CF01",
        "G3-GF-012-CF01",
        "G3-ROOT-001-CF01",
        "G3-USER-001-CF01",
        "G3-USER-002-CF01",
        "G3-USER-003-CF01",
        "G3-USER-004-CF01",
        "G3-USER-005-CF01",
        "G3-USER-006-CF01",
        "G3-USER-007-CF01",
        "G3-USER-008-CF01"
      ]
    },
    {
      "operator_ref": "meaning_preserving_paraphrase",
      "operator_sha256": "df96631f25558c47529a5fcbd96123f013c3a724300237ed56a15aabcfbc53bb",
      "coverage_source": "episode_relation",
      "authority_refs": []
    },
    {
      "operator_ref": "physical_source_plan_change",
      "operator_sha256": "8514297eaff8f27402368974bf389544806816c0480e00f9bca392f863b197a3",
      "coverage_source": "missing",
      "authority_refs": []
    },
    {
      "operator_ref": "ratio_aggregation_change",
      "operator_sha256": "5b4955cf3dc7ce1749dc9be643eed1595608cfd8a8fe081742916daeba48a9a2",
      "coverage_source": "missing",
      "authority_refs": []
    },
    {
      "operator_ref": "schedule_correction_race",
      "operator_sha256": "d64bd84b408e34f532bfaa96f48a93e95c75fcae7e7b778b0a092f4fcd6fb57c",
      "coverage_source": "missing",
      "authority_refs": []
    },
    {
      "operator_ref": "schedule_crash_resume",
      "operator_sha256": "33bed17875e75a1cb39a1e446c96c715cce5eb7a2bf535dc4774944bf12a4804",
      "coverage_source": "missing",
      "authority_refs": []
    },
    {
      "operator_ref": "schedule_duplicate_delivery",
      "operator_sha256": "bd52f470d7bd8788bc5c143d864afbbc7033a565672087b7ffd8bf0b16b29bbd",
      "coverage_source": "missing",
      "authority_refs": []
    },
    {
      "operator_ref": "schedule_lease_takeover",
      "operator_sha256": "0dc4e92ca20fef34cfa50f9483f9418ea57f2f21d994560f2b43a8e1ec7bafde",
      "coverage_source": "missing",
      "authority_refs": []
    },
    {
      "operator_ref": "stale_authority_delivery",
      "operator_sha256": "9b1f550e67e8003ff834d161255b1375dda1b74252d4b6c0629a186846b05d51",
      "coverage_source": "missing",
      "authority_refs": []
    },
    {
      "operator_ref": "technical_retry",
      "operator_sha256": "6a4a775d61ee926074e947ca4a1f9ba2737bce23b9a8e79b6554945628af3c4d",